<?xml version="1.0" encoding="UTF-8"?>
<!DOCTYPE pr SYSTEM "pr.dtd">
<pr>
    <info>
        <key_name>Project Record</key_name>
        <title>TPC3 DAW 2020</title>
        <subtitle>DTD e XML</subtitle>
        <begin_date>Outubro 2020</begin_date>
        <end_date>Outubro 2020</end_date>
        <supervisor url="http://www4.di.uminho.pt/~jcr/">José Carlos Ramalho</supervisor>
    </info>
    <workteam>
        <element>
            <name>João Nuno Abreu</name>
            <id_number>84802</id_number>
            <email>a84802@alunos.uminho.pt</email>
            <git_link url="https://github.com/joaonunoabreu/">GitHub</git_link>
        </element>
    </workteam>
    <abstract>
        <words>O XML, validado pelo schema, juntamente com o potente processamento via XSLT, permite dispor de <italic>facilidades acrescidas</italic> no tratamento de informação de uma forma <bold>standard e partilhável</bold>. Estas são, além de outras evidentes vantagens, as que abrem caminho a uma mais que provável evolução desta tecnologia nos círculos comerciais e de investigação. Outro facto importante, diz respeito à substituição de interfaces EDI por XML em aplicações bussiness oriented.</words>
        <words>O trabalho apresentado contempla um <bold>schema, uma stylesheet, e a instância do schema</bold> em XML. A instância é o próprio relatório.</words>
        <words>O trabalho pretende definir uma <italic>estrutura expedita e funcional</italic>, passível de ser aplicada a um trabalho descritivo, como por exemplo uma tese. Não é objectivo do trabalho criar uma implementação sistemática de todos os objectos possíveis, mas sim criar algumas utilizações mais comuns para exemplificar a potência destas linguagens.</words>
        <words>Ficam neste trabalho em aberto algumas ideias, a serem aplicadas mais tarde a quando da escrita da tese, ou pré-tese, porque na verdade o facto de manter o documento num formato exportável para vários formatos, para várias plataformas, e anotado, garante qualquer tratamento no futuro, constituindo uma vantagem muito importante a ter em conta. </words>
        <words>Exemplo de link no parágrafo <link url="https://google.com"></link></words>
    </abstract>
    <deliverables>
        <deliverable url="./pr.xml">XML do project record</deliverable>
        <deliverable url="./pr.xsl">XSL do project record</deliverable>
        <deliverable url="./pr.html">HTML do project record</deliverable>
        <deliverable url="./pr.dtd">Ficheiro DTD do PR</deliverable>
        <deliverable url="./arq.xml">XML dos arqueossitios</deliverable>
        <deliverable url="./arq.xsl">XSL dos arqueossitios </deliverable>
        <deliverable url="./site/index.html">indice dos arqueossitios</deliverable>
    </deliverables>
    <date>29-10-2020</date>
</pr>